{
  "schema_version": "1.0.0",
  "description": "Default command and CWD category taxonomy for process triage. Categories are features for Bayesian inference, not final classifications.",
  "command_categories": {
    "order": [
      "test",
      "devserver",
      "agent",
      "build",
      "editor",
      "server",
      "daemon",
      "database",
      "shell",
      "other"
    ],
    "default_category": "other",
    "categories": {
      "test": {
        "description": "Test runners and testing frameworks. Typically short-lived, often left running accidentally.",
        "patterns": [
          { "type": "contains", "value": "bun test", "field": "cmdline" },
          { "type": "contains", "value": "jest", "field": "cmdline" },
          { "type": "contains", "value": "pytest", "field": "cmdline" },
          { "type": "contains", "value": "mocha", "field": "cmdline" },
          { "type": "contains", "value": "vitest", "field": "cmdline" },
          { "type": "contains", "value": "cargo test", "field": "cmdline" },
          { "type": "contains", "value": "go test", "field": "cmdline" },
          { "type": "contains", "value": "npm test", "field": "cmdline" },
          { "type": "contains", "value": "yarn test", "field": "cmdline" },
          { "type": "contains", "value": "pnpm test", "field": "cmdline" },
          { "type": "regex", "value": "\\brunner\\b.*test", "field": "cmdline" },
          { "type": "contains", "value": "rspec", "field": "cmdline" },
          { "type": "contains", "value": "minitest", "field": "cmdline" },
          { "type": "contains", "value": "phpunit", "field": "cmdline" },
          { "type": "contains", "value": "unittest", "field": "cmdline" },
          { "type": "contains", "value": "nose2", "field": "cmdline" },
          { "type": "exact", "value": "bats", "field": "comm" }
        ],
        "examples": [
          "bun test --watch",
          "jest --coverage",
          "pytest -v tests/",
          "cargo test --all"
        ],
        "prior_adjustments": {
          "useful_mult": 0.8,
          "useful_bad_mult": 1.2,
          "abandoned_mult": 2.0,
          "zombie_mult": 1.5
        },
        "typical_lifetime": {
          "typical_min_seconds": 1,
          "typical_max_seconds": 3600,
          "stale_after_seconds": 7200,
          "suspicious_after_seconds": 14400
        },
        "subcategories": {
          "watch": {
            "description": "Test watchers that re-run on file changes",
            "patterns": [
              { "type": "contains", "value": "--watch", "field": "cmdline" },
              { "type": "contains", "value": "-w", "field": "cmdline" }
            ],
            "examples": ["jest --watch", "vitest --watch"],
            "typical_lifetime": {
              "typical_min_seconds": 60,
              "typical_max_seconds": 86400,
              "stale_after_seconds": 172800,
              "suspicious_after_seconds": 259200
            }
          }
        }
      },
      "devserver": {
        "description": "Development servers with hot-reload. Expected to run during development sessions.",
        "patterns": [
          { "type": "contains", "value": "next dev", "field": "cmdline" },
          { "type": "contains", "value": "vite", "field": "cmdline" },
          { "type": "contains", "value": "webpack serve", "field": "cmdline" },
          { "type": "contains", "value": "webpack-dev-server", "field": "cmdline" },
          { "type": "contains", "value": "--hot", "field": "cmdline" },
          { "type": "contains", "value": "npm run dev", "field": "cmdline" },
          { "type": "contains", "value": "yarn dev", "field": "cmdline" },
          { "type": "contains", "value": "pnpm dev", "field": "cmdline" },
          { "type": "contains", "value": "flask run", "field": "cmdline" },
          { "type": "contains", "value": "django runserver", "field": "cmdline" },
          { "type": "contains", "value": "rails server", "field": "cmdline" },
          { "type": "contains", "value": "rails s", "field": "cmdline" },
          { "type": "contains", "value": "php artisan serve", "field": "cmdline" },
          { "type": "contains", "value": "cargo watch", "field": "cmdline" },
          { "type": "contains", "value": "air", "field": "comm", "comment": "Go live reload" },
          { "type": "contains", "value": "nodemon", "field": "cmdline" },
          { "type": "contains", "value": "ts-node-dev", "field": "cmdline" },
          { "type": "contains", "value": "tsx watch", "field": "cmdline" }
        ],
        "examples": [
          "next dev -p 3000",
          "vite --port 5173",
          "flask run --reload",
          "nodemon server.js"
        ],
        "prior_adjustments": {
          "useful_mult": 0.9,
          "useful_bad_mult": 1.1,
          "abandoned_mult": 1.8,
          "zombie_mult": 1.3
        },
        "typical_lifetime": {
          "typical_min_seconds": 60,
          "typical_max_seconds": 86400,
          "stale_after_seconds": 172800,
          "suspicious_after_seconds": 604800
        }
      },
      "agent": {
        "description": "AI coding agents and assistants. May spawn subprocesses and run for extended periods.",
        "patterns": [
          { "type": "contains", "value": "claude", "field": "cmdline" },
          { "type": "contains", "value": "codex", "field": "cmdline" },
          { "type": "contains", "value": "copilot", "field": "cmdline" },
          { "type": "contains", "value": "gemini", "field": "cmdline" },
          { "type": "contains", "value": "aider", "field": "cmdline" },
          { "type": "contains", "value": "cursor", "field": "cmdline" },
          { "type": "contains", "value": "cody", "field": "cmdline" },
          { "type": "contains", "value": "continue", "field": "cmdline" },
          { "type": "regex", "value": "\\bgpt\\b", "field": "cmdline" },
          { "type": "contains", "value": "anthropic", "field": "cmdline" },
          { "type": "contains", "value": "openai", "field": "cmdline" }
        ],
        "examples": [
          "claude --dangerously-skip-permissions",
          "aider --model gpt-4",
          "cursor ."
        ],
        "prior_adjustments": {
          "useful_mult": 1.0,
          "useful_bad_mult": 0.8,
          "abandoned_mult": 1.5,
          "zombie_mult": 1.2
        },
        "typical_lifetime": {
          "typical_min_seconds": 60,
          "typical_max_seconds": 43200,
          "stale_after_seconds": 86400,
          "suspicious_after_seconds": 172800
        }
      },
      "build": {
        "description": "Build tools and compilers. Usually short-lived but can be resource-intensive.",
        "patterns": [
          { "type": "contains", "value": "webpack", "field": "cmdline" },
          { "type": "contains", "value": "esbuild", "field": "cmdline" },
          { "type": "contains", "value": "rollup", "field": "cmdline" },
          { "type": "contains", "value": "parcel", "field": "cmdline" },
          { "type": "contains", "value": "tsc", "field": "cmdline" },
          { "type": "contains", "value": "typescript", "field": "cmdline" },
          { "type": "exact", "value": "make", "field": "comm" },
          { "type": "exact", "value": "cmake", "field": "comm" },
          { "type": "exact", "value": "ninja", "field": "comm" },
          { "type": "contains", "value": "cargo build", "field": "cmdline" },
          { "type": "contains", "value": "go build", "field": "cmdline" },
          { "type": "exact", "value": "gcc", "field": "comm" },
          { "type": "exact", "value": "g++", "field": "comm" },
          { "type": "exact", "value": "clang", "field": "comm" },
          { "type": "exact", "value": "rustc", "field": "comm" },
          { "type": "contains", "value": "npm run build", "field": "cmdline" },
          { "type": "contains", "value": "yarn build", "field": "cmdline" },
          { "type": "contains", "value": "gradle", "field": "cmdline" },
          { "type": "contains", "value": "maven", "field": "cmdline" },
          { "type": "exact", "value": "mvn", "field": "comm" }
        ],
        "examples": [
          "webpack --mode production",
          "cargo build --release",
          "tsc --build",
          "make -j8"
        ],
        "prior_adjustments": {
          "useful_mult": 1.0,
          "useful_bad_mult": 1.5,
          "abandoned_mult": 1.3,
          "zombie_mult": 2.0
        },
        "typical_lifetime": {
          "typical_min_seconds": 1,
          "typical_max_seconds": 1800,
          "stale_after_seconds": 3600,
          "suspicious_after_seconds": 7200
        }
      },
      "editor": {
        "description": "Text editors and IDEs. Long-running by nature.",
        "patterns": [
          { "type": "exact", "value": "code", "field": "comm" },
          { "type": "contains", "value": "code-server", "field": "cmdline" },
          { "type": "exact", "value": "vim", "field": "comm" },
          { "type": "exact", "value": "nvim", "field": "comm" },
          { "type": "exact", "value": "neovim", "field": "comm" },
          { "type": "exact", "value": "emacs", "field": "comm" },
          { "type": "exact", "value": "nano", "field": "comm" },
          { "type": "exact", "value": "sublime_text", "field": "comm" },
          { "type": "contains", "value": "idea", "field": "cmdline", "comment": "IntelliJ IDEA" },
          { "type": "contains", "value": "webstorm", "field": "cmdline" },
          { "type": "contains", "value": "pycharm", "field": "cmdline" },
          { "type": "contains", "value": "goland", "field": "cmdline" },
          { "type": "contains", "value": "rubymine", "field": "cmdline" },
          { "type": "contains", "value": "atom", "field": "cmdline" },
          { "type": "contains", "value": "zed", "field": "cmdline" },
          { "type": "exact", "value": "helix", "field": "comm" }
        ],
        "examples": [